,ticker,etf,link
416,AGRH,iShares Interest Rate Hedged U.S. Aggregate Bond ETF,https://www.ishares.com/us/products/328180/ishares-interest-rate-hedged-u-s-aggregate-bond-etf
417,EFRA,iShares Environmental Infrastructure and Industrials ETF,https://www.ishares.com/us/products/330188/ishares-environmental-infrastructure-and-industrials-etf
418,IVEG,iShares Emergent Food and AgTech Multisector ETF,https://www.ishares.com/us/products/326601/ishares-emergent-food-and-agtech-multisector-etf
419,BPAY,BlackRock Future Financial and Technology ETF,https://www.ishares.com/us/products/329128/blackrock-future-financial-and-technology-etf
420,ITDI,iShares® LifePath® Target Date 2065 ETF,https://www.ishares.com/us/products/333575/ishares-lifepath-target-date-2065-etf
421,ITDH,iShares® LifePath® Target Date 2060 ETF,https://www.ishares.com/us/products/333572/ishares-lifepath-target-date-2060-etf
422,BMED,BlackRock Future Health ETF,https://www.ishares.com/us/products/316007/blackrock-future-health-etf
423,IBIK,iShares® iBonds® Oct 2034 Term TIPS ETF,https://www.ishares.com/us/products/337462/ishares-ibonds-oct-2034-term-tips-etf
424,IBRN,iShares Neuroscience and Healthcare ETF,https://www.ishares.com/us/products/329137/ishares-neuroscience-and-healthcare-etf
425,ETEC,iShares Breakthrough Environmental Solutions ETF,https://www.ishares.com/us/products/331244/ishares-breakthrough-environmental-solutions-etf
426,ITDA,iShares® LifePath® Target Date 2025 ETF,https://www.ishares.com/us/products/333552/ishares-lifepath-target-date-2025-etf
427,IRTR,iShares® LifePath® Retirement ETF,https://www.ishares.com/us/products/333579/ishares-lifepath-retirement-etf
428,BECO,BlackRock Future Climate and Sustainable Economy ETF,https://www.ishares.com/us/products/320098/blackrock-future-climate-and-sustainable-economy-etf
429,IWFH,iShares Virtual Work and Life Multisector ETF,https://www.ishares.com/us/products/315979/ishares-virtual-work-and-life-multisector-etf
430,HYGI,iShares Inflation Hedged High Yield Bond ETF,https://www.ishares.com/us/products/328091/ishares-inflation-hedged-high-yield-bond-etf
431,IBMS,iShares® iBonds® Dec 2030 Term Muni Bond ETF,https://www.ishares.com/us/products/337460/ishares-ibonds-dec-2030-term-muni-bond-etf
432,ILIT,iShares Lithium Miners and Producers ETF,https://www.ishares.com/us/products/332281/ishares-lithium-miners-and-producers-etf
433,AGIH,iShares Inflation Hedged U.S. Aggregate Bond ETF,https://www.ishares.com/us/products/328179/ishares-inflation-hedged-u-s-aggregate-bond-etf
434,,,
