,ticker,etf,link
0,IVV,iShares Core S&P 500 ETF,https://www.ishares.com/us/products/239726/ishares-core-sp-500-etf
1,IEFA,iShares Core MSCI EAFE ETF,https://www.ishares.com/us/products/244049/ishares-core-msci-eafe-etf
2,AGG,iShares Core U.S. Aggregate Bond ETF,https://www.ishares.com/us/products/239458/ishares-core-total-us-bond-market-etf
3,IWF,iShares Russell 1000 Growth ETF,https://www.ishares.com/us/products/239706/ishares-russell-1000-growth-etf
4,IJH,iShares Core S&P Mid-Cap ETF,https://www.ishares.com/us/products/239763/ishares-core-sp-midcap-etf
5,IEMG,iShares Core MSCI Emerging Markets ETF,https://www.ishares.com/us/products/244050/ishares-core-msci-emerging-markets-etf
6,IJR,iShares Core S&P Small-Cap ETF,https://www.ishares.com/us/products/239774/ishares-core-sp-smallcap-etf
7,IWM,iShares Russell 2000 ETF,https://www.ishares.com/us/products/239710/ishares-russell-2000-etf
8,ITOT,iShares Core S&P Total U.S. Stock Market ETF,https://www.ishares.com/us/products/239724/ishares-core-sp-total-us-stock-market-etf
9,IWD,iShares Russell 1000 Value ETF,https://www.ishares.com/us/products/239708/ishares-russell-1000-value-etf
10,EFA,iShares MSCI EAFE ETF,https://www.ishares.com/us/products/239623/ishares-msci-eafe-etf
11,IVW,iShares S&P 500 Growth ETF,https://www.ishares.com/us/products/239725/ishares-sp-500-growth-etf
12,TLT,iShares 20+ Year Treasury Bond ETF,https://www.ishares.com/us/products/239454/ishares-20-year-treasury-bond-etf
13,QUAL,iShares MSCI USA Quality Factor ETF,https://www.ishares.com/us/products/256101/ishares-msci-usa-quality-factor-etf
14,MUB,iShares National Muni Bond ETF,https://www.ishares.com/us/products/239766/ishares-national-amtfree-muni-bond-etf
15,IXUS,iShares Core MSCI Total International Stock ETF,https://www.ishares.com/us/products/244048/ishares-core-msci-total-international-stock-etf
16,IWB,iShares Russell 1000 ETF,https://www.ishares.com/us/products/239707/ishares-russell-1000-etf
17,IWR,iShares Russell Mid-Cap ETF,https://www.ishares.com/us/products/239718/ishares-russell-midcap-etf
18,IVE,iShares S&P 500 Value ETF,https://www.ishares.com/us/products/239728/ishares-sp-500-value-etf
19,MBB,iShares MBS ETF,https://www.ishares.com/us/products/239465/ishares-mbs-etf
20,IEF,iShares 7-10 Year Treasury Bond ETF,https://www.ishares.com/us/products/239456/ishares-710-year-treasury-bond-etf
21,LQD,iShares iBoxx $ Investment Grade Corporate Bond ETF,https://www.ishares.com/us/products/239566/ishares-iboxx-investment-grade-corporate-bond-etf
22,IAU,iShares Gold Trust,https://www.ishares.com/us/products/239561/ishares-gold-trust-fund
23,IUSB,iShares Core Total USD Bond Market ETF,https://www.ishares.com/us/products/264615/ishares-core-total-usd-bond-market-etf
24,DGRO,iShares Core Dividend Growth ETF,https://www.ishares.com/us/products/264623/ishares-core-dividend-growth-etf
25,GOVT,iShares U.S. Treasury Bond ETF,https://www.ishares.com/us/products/239468/ishares-us-treasury-bond-etf
26,SHY,iShares 1-3 Year Treasury Bond ETF,https://www.ishares.com/us/products/239452/ishares-13-year-treasury-bond-etf
27,USMV,iShares MSCI USA Min Vol Factor ETF,https://www.ishares.com/us/products/239695/ishares-msci-usa-minimum-volatility-etf
28,SGOV,iShares 0-3 Month Treasury Bond ETF,https://www.ishares.com/us/products/314116/ishares-0-3-month-treasury-bond-etf
29,IBIT,iShares Bitcoin Trust,https://www.ishares.com/us/products/333011/ishares-bitcoin-trust
30,IGSB,iShares 1-5 Year Investment Grade Corporate Bond ETF,https://www.ishares.com/us/products/239451/ishares-13-year-credit-bond-etf
31,EEM,iShares MSCI Emerging Markets ETF,https://www.ishares.com/us/products/239637/ishares-msci-emerging-markets-etf
32,SHV,iShares Short Treasury Bond ETF,https://www.ishares.com/us/products/239466/ishares-short-treasury-bond-etf
33,ACWI,iShares MSCI ACWI ETF,https://www.ishares.com/us/products/239600/ishares-msci-acwi-etf
34,DVY,iShares Select Dividend ETF,https://www.ishares.com/us/products/239500/ishares-select-dividend-etf
35,TIP,iShares TIPS Bond ETF,https://www.ishares.com/us/products/239467/ishares-tips-bond-etf
36,IUSG,iShares Core S&P U.S. Growth ETF,https://www.ishares.com/us/products/239713/ishares-core-sp-us-growth-etf
37,IYW,iShares U.S. Technology ETF,https://www.ishares.com/us/products/239522/ishares-us-technology-etf
38,IUSV,iShares Core S&P U.S. Value ETF,https://www.ishares.com/us/products/239715/ishares-core-sp-us-value-etf
39,HYG,iShares iBoxx $ High Yield Corporate Bond ETF,https://www.ishares.com/us/products/239565/ishares-iboxx-high-yield-corporate-bond-etf
40,EFV,iShares MSCI EAFE Value ETF,https://www.ishares.com/us/products/239628/ishares-msci-eafe-value-etf
41,EWJ,iShares MSCI Japan ETF,https://www.ishares.com/us/products/239665/ishares-msci-japan-etf
42,SOXX,iShares Semiconductor ETF,https://www.ishares.com/us/products/239705/ishares-phlx-semiconductor-etf
43,EMB,iShares J.P. Morgan USD Emerging Markets Bond ETF,https://www.ishares.com/us/products/239572/ishares-jp-morgan-usd-emerging-markets-bond-etf
44,PFF,iShares Preferred and Income Securities ETF,https://www.ishares.com/us/products/239826/ishares-us-preferred-stock-etf
45,IWP,iShares Russell Mid-Cap Growth ETF,https://www.ishares.com/us/products/239717/ishares-russell-midcap-growth-etf
46,EFG,iShares MSCI EAFE Growth ETF,https://www.ishares.com/us/products/239622/ishares-msci-eafe-growth-etf
47,IWV,iShares Russell 3000 ETF,https://www.ishares.com/us/products/239714/ishares-russell-3000-etf
48,IDEV,iShares Core MSCI International Developed Markets ETF,https://www.ishares.com/us/products/286762/ishares-core-msci-international-developed-markets-etf
49,EMXC,iShares MSCI Emerging Markets ex China ETF,https://www.ishares.com/us/products/288504/ishares-msci-emerging-markets-ex-china-etf
50,IEI,iShares 3-7 Year Treasury Bond ETF,https://www.ishares.com/us/products/239455/ishares-37-year-treasury-bond-etf
51,IGIB,iShares 5-10 Year Investment Grade Corporate Bond ETF,https://www.ishares.com/us/products/239463/ishares-intermediate-credit-bond-etf
52,USHY,iShares Broad USD High Yield Corporate Bond ETF,https://www.ishares.com/us/products/291299/ishares-broad-usd-high-yield-corporate-bond-etf
53,ESGU,iShares ESG Aware MSCI USA ETF,https://www.ishares.com/us/products/286007/ishares-esg-aware-msci-usa-etf
54,IWS,iShares Russell Mid-Cap Value ETF,https://www.ishares.com/us/products/239719/ishares-russell-midcap-value-etf
55,SLV,iShares Silver Trust,https://www.ishares.com/us/products/239855/ishares-silver-trust-fund
56,OEF,iShares S&P 100 ETF,https://www.ishares.com/us/products/239723/ishares-sp-100-etf
57,IWN,iShares Russell 2000 Value ETF,https://www.ishares.com/us/products/239712/ishares-russell-2000-value-etf
58,USIG,iShares Broad USD Investment Grade Corporate Bond ETF,https://www.ishares.com/us/products/239460/ishares-credit-bond-etf
59,INDA,iShares MSCI India ETF,https://www.ishares.com/us/products/239659/ishares-msci-india-etf
60,IWO,iShares Russell 2000 Growth ETF,https://www.ishares.com/us/products/239709/ishares-russell-2000-growth-etf
61,IWY,iShares Russell Top 200 Growth ETF,https://www.ishares.com/us/products/239720/ishares-russell-top-200-growth-etf
62,HDV,iShares Core High Dividend ETF,https://www.ishares.com/us/products/239563/ishares-high-dividend-etf
63,MTUM,iShares MSCI USA Momentum Factor ETF,https://www.ishares.com/us/products/251614/ishares-msci-usa-momentum-factor-etf
64,SCZ,iShares MSCI EAFE Small-Cap ETF,https://www.ishares.com/us/products/239627/ishares-msci-eafe-smallcap-etf
65,IJK,iShares S&P Mid-Cap 400 Growth ETF,https://www.ishares.com/us/products/239762/ishares-sp-midcap-400-growth-etf
66,DYNF,BlackRock U.S. Equity Factor Rotation ETF,https://www.ishares.com/us/products/307283/blackrock-u-s-equity-factor-rotation-etf
67,SUB,iShares Short-Term National Muni Bond ETF,https://www.ishares.com/us/products/239772/ishares-shortterm-national-amtfree-muni-bond-etf
68,ESGD,iShares ESG Aware MSCI EAFE ETF,https://www.ishares.com/us/products/283778/ishares-esg-aware-msci-eafe-etf
69,IQLT,iShares MSCI Intl Quality Factor ETF,https://www.ishares.com/us/products/271540/ishares-msci-international-developed-quality-factor-etf
70,STIP,iShares 0-5 Year TIPS Bond ETF,https://www.ishares.com/us/products/239450/ishares-05-year-tips-bond-etf
71,EZU,iShares MSCI Eurozone ETF,https://www.ishares.com/us/products/239644/ishares-msci-emu-etf
72,TLH,iShares 10-20 Year Treasury Bond ETF,https://www.ishares.com/us/products/239453/ishares-1020-year-treasury-bond-etf
73,IJJ,iShares S&P Mid-Cap 400 Value ETF,https://www.ishares.com/us/products/239764/ishares-sp-midcap-400-value-etf
74,FLOT,iShares Floating Rate Bond ETF,https://www.ishares.com/us/products/239534/ishares-floating-rate-bond-etf
75,IBB,iShares Biotechnology ETF,https://www.ishares.com/us/products/239699/ishares-biotechnology-etf
76,VLUE,iShares MSCI USA Value Factor ETF,https://www.ishares.com/us/products/251616/ishares-msci-usa-value-factor-etf
77,TFLO,iShares Treasury Floating Rate Bond ETF,https://www.ishares.com/us/products/260652/ishares-treasury-floating-rate-bond-etf
78,EFAV,iShares MSCI EAFE Min Vol Factor ETF,https://www.ishares.com/us/products/239626/ishares-msci-eafe-minimum-volatility-etf
79,IJS,iShares S&P Small-Cap 600 Value ETF,https://www.ishares.com/us/products/239775/ishares-sp-smallcap-600-value-etf
80,ITA,iShares U.S. Aerospace & Defense ETF,https://www.ishares.com/us/products/239502/ishares-us-aerospace-defense-etf
81,HEFA,iShares Currency Hedged MSCI EAFE ETF,https://www.ishares.com/us/products/259622/ishares-currency-hedged-msci-eafe-etf
82,SHYG,iShares 0-5 Year High Yield Corporate Bond ETF,https://www.ishares.com/us/products/258100/ishares-05-year-high-yield-corporate-bond-etf
83,IAGG,iShares Core International Aggregate Bond ETF,https://www.ishares.com/us/products/279626/ishares-international-aggregate-bond-etf
84,IGV,iShares Expanded Tech-Software Sector ETF,https://www.ishares.com/us/products/239771/ishares-north-american-techsoftware-etf
85,IJT,iShares S&P Small-Cap 600 Growth ETF,https://www.ishares.com/us/products/239773/ishares-sp-smallcap-600-growth-etf
86,IOO,iShares Global 100 ETF,https://www.ishares.com/us/products/239737/ishares-global-100-etf
87,MCHI,iShares MSCI China ETF,https://www.ishares.com/us/products/239619/ishares-msci-china-etf
88,ICSH,BlackRock Ultra Short-Term Bond ETF,https://www.ishares.com/us/products/258806/ishares-liquidity-income-etf
89,EWY,iShares MSCI South Korea ETF,https://www.ishares.com/us/products/239681/ishares-msci-south-korea-capped-etf
90,IHI,iShares U.S. Medical Devices ETF,https://www.ishares.com/us/products/239516/ishares-us-medical-devices-etf
91,IEUR,iShares Core MSCI Europe ETF,https://www.ishares.com/us/products/264617/ishares-core-msci-europe-etf
92,EWT,iShares MSCI Taiwan ETF,https://www.ishares.com/us/products/239686/ishares-msci-taiwan-etf
93,IXN,iShares Global Tech ETF,https://www.ishares.com/us/products/239750/ishares-global-tech-etf
94,FXI,iShares China Large-Cap ETF,https://www.ishares.com/us/products/239536/ishares-china-largecap-etf
95,IGM,iShares Expanded Tech Sector ETF,https://www.ishares.com/us/products/239769/ishares-north-american-tech-etf
96,ACWX,iShares MSCI ACWI ex U.S. ETF,https://www.ishares.com/us/products/239594/ishares-msci-acwi-ex-us-etf
97,DSI,iShares MSCI KLD 400 Social ETF,https://www.ishares.com/us/products/239667/ishares-msci-kld-400-social-etf
98,EEMV,iShares MSCI Emerging Markets Min Vol Factor ETF,https://www.ishares.com/us/products/239641/ishares-msci-emerging-markets-minimum-volatility-etf
99,EWZ,iShares MSCI Brazil ETF,https://www.ishares.com/us/products/239612/ishares-msci-brazil-capped-etf
100,ACWV,iShares MSCI Global Min Vol Factor ETF,https://www.ishares.com/us/products/239605/ishares-msci-all-country-world-minimum-volatility-etf
101,IDV,iShares International Select Dividend ETF,https://www.ishares.com/us/products/239499/ishares-international-select-dividend-etf
102,ESGE,iShares ESG Aware MSCI EM ETF,https://www.ishares.com/us/products/283777/ishares-esg-aware-msci-em-etf
103,IXJ,iShares Global Healthcare ETF,https://www.ishares.com/us/products/239744/ishares-global-healthcare-etf
104,ISTB,iShares Core 1-5 Year USD Bond ETF,https://www.ishares.com/us/products/244051/ishares-core-shortterm-us-bond-etf
105,IGF,iShares Global Infrastructure ETF,https://www.ishares.com/us/products/239746/ishares-global-infrastructure-etf
106,EAGG,iShares ESG Aware U.S. Aggregate Bond ETF,https://www.ishares.com/us/products/305252/ishares-esg-aware-u-s-aggregate-bond-etf
107,REET,iShares Global REIT ETF,https://www.ishares.com/us/products/268752/ishares-global-reit-etf
108,URTH,iShares MSCI World ETF,https://www.ishares.com/us/products/239696/ishares-msci-world-etf
109,SUSA,iShares MSCI USA ESG Select ETF,https://www.ishares.com/us/products/239692/ishares-msci-usa-esg-select-etf
110,XT,iShares Exponential Technologies ETF,https://www.ishares.com/us/products/272532/ishares-exponential-technologies-etf
111,IYH,iShares U.S. Healthcare ETF,https://www.ishares.com/us/products/239511/ishares-us-healthcare-etf
112,BINC,BlackRock Flexible Income ETF,https://www.ishares.com/us/products/331752/blackrock-flexible-income-etf
113,GVI,iShares Intermediate Government/Credit Bond ETF,https://www.ishares.com/us/products/239464/ishares-intermediate-governmentcredit-bond-etf
114,NEAR,BlackRock Short Duration Bond ETF,https://www.ishares.com/us/products/239854/ishares-short-maturity-bond-etf
115,IYR,iShares U.S. Real Estate ETF,https://www.ishares.com/us/products/239520/ishares-us-real-estate-etf
116,CMF,iShares California Muni Bond ETF,https://www.ishares.com/us/products/239731/ishares-california-amtfree-muni-bond-etf
117,EWU,iShares MSCI United Kingdom ETF,https://www.ishares.com/us/products/239690/ishares-msci-united-kingdom-etf
118,IBTE,iShares® iBonds® Dec 2024 Term Treasury ETF,https://www.ishares.com/us/products/312451/ishares-ibonds-dec-2024-term-treasury-etf
119,IXC,iShares Global Energy ETF,https://www.ishares.com/us/products/239741/ishares-global-energy-etf
120,IBDR,iShares® iBonds® Dec 2026 Term Corporate ETF,https://www.ishares.com/us/products/285027/ishares-ibonds-dec-2026-term-corporate-etf-fund
121,ITB,iShares U.S. Home Construction ETF,https://www.ishares.com/us/products/239512/ishares-us-home-construction-etf
122,IBDQ,iShares® iBonds® Dec 2025 Term Corporate ETF,https://www.ishares.com/us/products/272346/ishares-ibonds-dec-2025-corporate-etf
123,IYF,iShares U.S. Financials ETF,https://www.ishares.com/us/products/239508/ishares-us-financials-etf
124,IBDP,iShares® iBonds® Dec 2024 Term Corporate ETF,https://www.ishares.com/us/products/272345/ishares-ibonds-dec-2024-corporate-etf
125,EWC,iShares MSCI Canada ETF,https://www.ishares.com/us/products/239615/ishares-msci-canada-etf
126,AAXJ,iShares MSCI All Country Asia ex Japan ETF,https://www.ishares.com/us/products/239601/ishares-msci-all-country-asia-ex-japan-etf
127,ICLN,iShares Global Clean Energy ETF,https://www.ishares.com/us/products/239738/ishares-global-clean-energy-etf
128,IBDS,iShares® iBonds® Dec 2027 Term Corporate ETF,https://www.ishares.com/us/products/290315/ishares-ibonds-dec-2027-term-corporate-etf
129,IFRA,iShares U.S. Infrastructure ETF,https://www.ishares.com/us/products/294315/ishares-u-s-infrastructure-etf
130,USRT,iShares Core U.S. REIT ETF,https://www.ishares.com/us/products/239544/ishares-real-estate-50-etf
131,IBTF,iShares® iBonds® Dec 2025 Term Treasury ETF,https://www.ishares.com/us/products/312454/ishares-ibonds-dec-2025-term-treasury-etf
132,ILCG,iShares Morningstar Growth ETF,https://www.ishares.com/us/products/239580/ishares-morningstar-largecap-growth-etf
133,IGLB,iShares 10+ Year Investment Grade Corporate Bond ETF,https://www.ishares.com/us/products/239423/ishares-10-year-credit-bond-etf
134,IWX,iShares Russell Top 200 Value ETF,https://www.ishares.com/us/products/239722/ishares-russell-top-200-value-etf
135,IMTM,iShares MSCI Intl Momentum Factor ETF,https://www.ishares.com/us/products/271538/ishares-msci-international-developed-momentum-factor-etf
136,SLQD,iShares 0-5 Year Investment Grade Corporate Bond ETF,https://www.ishares.com/us/products/258098/ishares-05-year-investment-grade-corporate-bond-etf
137,AOR,iShares Core Growth Allocation ETF,https://www.ishares.com/us/products/239756/ishares-growth-allocation-etf
138,USCL,iShares Climate Conscious & Transition MSCI USA ETF,https://www.ishares.com/us/products/332075/ishares-climate-conscious-transition-msci-usa-etf
139,ICF,iShares Cohen & Steers REIT ETF,https://www.ishares.com/us/products/239482/ishares-cohen-steers-reit-etf
140,LRGF,iShares U.S. Equity Factor ETF,https://www.ishares.com/us/products/272824/ishares-msci-usa-multi-factor-etf
141,EPP,iShares MSCI Pacific ex Japan ETF,https://www.ishares.com/us/products/239674/ishares-msci-pacific-ex-japan-etf
142,ICVT,iShares Convertible Bond ETF,https://www.ishares.com/us/products/272819/ishares-convertible-bond-etf
143,IMCG,iShares Morningstar Mid-Cap Growth ETF,https://www.ishares.com/us/products/239583/ishares-morningstar-midcap-growth-etf
144,IYY,iShares Dow Jones U.S. ETF,https://www.ishares.com/us/products/239513/ishares-dow-jones-us-etf
145,IPAC,iShares Core MSCI Pacific ETF,https://www.ishares.com/us/products/264619/ishares-core-msci-pacific-etf
146,AOA,iShares Core Aggressive Allocation ETF,https://www.ishares.com/us/products/239729/ishares-aggressive-allocation-etf
147,PABU,iShares Paris-Aligned Climate MSCI USA ETF,https://www.ishares.com/us/products/325725/ishares-paris-aligned-climate-msci-usa-etf
148,IBDT,iShares® iBonds® Dec 2028 Term Corporate ETF,https://www.ishares.com/us/products/304570/ishares-ibonds-dec-2028-term-corporate-etf
149,IVLU,iShares MSCI Intl Value Factor ETF,https://www.ishares.com/us/products/275382/ishares-msci-international-developed-value-factor-etf
150,IEV,iShares Europe ETF,https://www.ishares.com/us/products/239736/ishares-europe-etf
151,EWW,iShares MSCI Mexico ETF,https://www.ishares.com/us/products/239670/ishares-msci-mexico-capped-etf
152,FALN,iShares Fallen Angels USD Bond ETF,https://www.ishares.com/us/products/283855/ishares-fallen-angels-usd-bond-etf
153,EWA,iShares MSCI Australia ETF,https://www.ishares.com/us/products/239607/ishares-msci-australia-etf
154,EUFN,iShares MSCI Europe Financials ETF,https://www.ishares.com/us/products/239645/ishares-msci-europe-financials-etf
155,ESML,iShares ESG Aware MSCI USA Small-Cap ETF,https://www.ishares.com/us/products/296644/ishares-esg-aware-msci-usa-small-cap-etf
156,AIA,iShares Asia 50 ETF,https://www.ishares.com/us/products/239730/ishares-asia-50-etf
157,IYJ,iShares U.S. Industrials ETF,https://www.ishares.com/us/products/239514/ishares-us-industrials-etf
158,ILF,iShares Latin America 40 ETF,https://www.ishares.com/us/products/239761/ishares-latin-america-40-etf
159,IWL,iShares Russell Top 200 ETF,https://www.ishares.com/us/products/239721/ishares-russell-top-200-etf
160,AOM,iShares Core Moderate Allocation ETF,https://www.ishares.com/us/products/239765/ishares-moderate-allocation-etf
161,IBDU,iShares® iBonds® Dec 2029 Term Corporate ETF,https://www.ishares.com/us/products/310035/ishares-ibonds-dec-2029-term-corporate-etf
162,IYE,iShares U.S. Energy ETF,https://www.ishares.com/us/products/239507/ishares-us-energy-etf
163,IYG,iShares U.S. Financial Services ETF,https://www.ishares.com/us/products/239509/ishares-us-financial-services-etf
164,IDU,iShares U.S. Utilities ETF,https://www.ishares.com/us/products/239524/ishares-us-utilities-etf
165,IGEB,iShares Investment Grade Systematic Bond ETF,https://www.ishares.com/us/products/288302/ishares-investment-grade-systematic-bond-etf
166,PICK,iShares MSCI Global Metals & Mining Producers ETF,https://www.ishares.com/us/products/239655/ishares-msci-global-metals-mining-producers-etf
167,IYK,iShares U.S. Consumer Staples ETF,https://www.ishares.com/us/products/239505/ishares-us-consumer-staples-etf
168,LCTU,BlackRock U.S. Carbon Transition Readiness ETF,https://www.ishares.com/us/products/318215/blackrock-u-s-carbon-transition-readiness-etf
169,EWL,iShares MSCI Switzerland ETF,https://www.ishares.com/us/products/239685/ishares-msci-switzerland-capped-etf
170,IAUM,iShares Gold Trust Micro,https://www.ishares.com/us/products/306979/ishares-gold-trust-micro
171,INTF,iShares International Equity Factor ETF,https://www.ishares.com/us/products/272822/ishares-msci-international-multi-factor-etf
172,IAI,iShares U.S. Broker-Dealers & Securities Exchanges ETF,https://www.ishares.com/us/products/239504/ishares-us-brokerdealers-etf
173,IBTG,iShares® iBonds® Dec 2026 Term Treasury ETF,https://www.ishares.com/us/products/312457/ishares-ibonds-dec-2026-term-treasury-etf
174,GSG,iShares S&P GSCI Commodity-Indexed Trust,https://www.ishares.com/us/products/239757/ishares-sp-gsci-commodityindexed-trust-fund
175,SMLF,iShares U.S. Small-Cap Equity Factor ETF,https://www.ishares.com/us/products/272825/ishares-msci-usa-small-cap-multi-factor-etf
176,SMMD,iShares Russell 2500 ETF,https://www.ishares.com/us/products/288024/ishares-russell-2500-etf
177,SUSC,iShares ESG Aware USD Corporate Bond ETF,https://www.ishares.com/us/products/288488/ishares-esg-aware-usd-corporate-bond-etf
178,USXF,iShares ESG Advanced MSCI USA ETF,https://www.ishares.com/us/products/314365/ishares-esg-advanced-msci-usa-etf
179,QLTA,iShares Aaa - A Rated Corporate Bond ETF,https://www.ishares.com/us/products/239431/ishares-aaa-a-rated-corporate-bond-etf
180,EWP,iShares MSCI Spain ETF,https://www.ishares.com/us/products/239683/ishares-msci-spain-capped-etf
181,SUSL,iShares ESG MSCI USA Leaders ETF,https://www.ishares.com/us/products/308574/ishares-esg-msci-usa-leaders-etf
182,IBDV,iShares® iBonds® Dec 2030 Term Corporate ETF,https://www.ishares.com/us/products/314496/ishares-ibonds-dec-2030-term-corporate-etf
183,COMT,iShares GSCI Commodity Dynamic Roll Strategy ETF,https://www.ishares.com/us/products/270319/ishares-commodity-etf
184,CRBN,iShares MSCI ACWI Low Carbon Target ETF,https://www.ishares.com/us/products/271054/ishares-msci-acwi-low-carbon-target-etf
185,EWG,iShares MSCI Germany ETF,https://www.ishares.com/us/products/239650/ishares-msci-germany-etf
186,SMIN,iShares MSCI India Small-Cap ETF,https://www.ishares.com/us/products/239660/ishares-msci-india-smallcap-etf
187,ILCV,iShares Morningstar Value ETF,https://www.ishares.com/us/products/239581/ishares-morningstar-largecap-value-etf
188,ILCB,iShares Morningstar U.S. Equity ETF,https://www.ishares.com/us/products/239579/ishares-morningstar-largecap-etf
189,IYC,iShares U.S. Consumer Discretionary ETF,https://www.ishares.com/us/products/239506/ishares-us-consumer-discretionary-etf
190,INDY,iShares India 50 ETF,https://www.ishares.com/us/products/239758/ishares-india-50-etf
191,IMCB,iShares Morningstar Mid-Cap ETF,https://www.ishares.com/us/products/239582/ishares-morningstar-midcap-etf
192,KXI,iShares Global Consumer Staples ETF,https://www.ishares.com/us/products/239740/ishares-global-consumer-staples-etf
193,SUSB,iShares ESG Aware 1-5 Year USD Corporate Bond ETF,https://www.ishares.com/us/products/288490/ishares-esg-aware-1-5-year-usd-corporate-bond-etf
194,TLTW,iShares 20+ Year Treasury Bond BuyWrite Strategy ETF,https://www.ishares.com/us/products/329118/ishares-20+-year-treasury-bond-buywrite-strategy-etf
195,IBTH,iShares® iBonds® Dec 2027 Term Treasury ETF,https://www.ishares.com/us/products/312460/ishares-ibonds-dec-2027-term-treasury-etf
196,IBDW,iShares® iBonds® Dec 2031 Term Corporate ETF,https://www.ishares.com/us/products/319154/ishares-ibonds-dec-2031-term-corporate-etf
197,IWC,iShares Micro-Cap ETF,https://www.ishares.com/us/products/239716/ishares-microcap-etf
198,IHAK,iShares Cybersecurity and Tech ETF,https://www.ishares.com/us/products/307352/ishares-cybersecurity-and-tech-etf
199,IYT,iShares U.S. Transportation ETF,https://www.ishares.com/us/products/239501/ishares-transportation-average-etf
200,SMMV,iShares MSCI USA Small-Cap Min Vol Factor ETF,https://www.ishares.com/us/products/284609/ishares-msci-usa-small-cap-min-vol-factor-etf
201,IEO,iShares U.S. Oil & Gas Exploration & Production ETF,https://www.ishares.com/us/products/239517/ishares-us-oil-gas-exploration-production-etf
202,IHF,iShares U.S. Healthcare Providers ETF,https://www.ishares.com/us/products/239510/ishares-us-healthcare-providers-etf
203,EUSA,iShares MSCI USA Equal Weighted ETF,https://www.ishares.com/us/products/239693/ishares-msci-usa-etf
204,NYF,iShares New York Muni Bond ETF,https://www.ishares.com/us/products/239767/ishares-new-york-amtfree-muni-bond-etf
205,DVYE,iShares Emerging Markets Dividend ETF,https://www.ishares.com/us/products/239526/ishares-emerging-markets-dividend-etf
206,IHE,iShares U.S. Pharmaceuticals ETF,https://www.ishares.com/us/products/239519/ishares-us-pharmaceuticals-etf
207,KSA,iShares MSCI Saudi Arabia ETF,https://www.ishares.com/us/products/271542/ishares-msci-saudi-arabia-capped-etf
208,IGRO,iShares International Dividend Growth ETF,https://www.ishares.com/us/products/283737/ishares-international-dividend-growth-etf
209,DMXF,iShares ESG Advanced MSCI EAFE ETF,https://www.ishares.com/us/products/314362/ishares-esg-advanced-msci-eafe-etf
210,IRBO,iShares Robotics and Artificial Intelligence Multisector ETF,https://www.ishares.com/us/products/297905/ishares-robotics-and-artificial-intelligence-multisector-etf
211,IBDX,iShares® iBonds® Dec 2032 Term Corporate ETF,https://www.ishares.com/us/products/328675/ishares-ibonds-dec-2032-term-corporate-etf
212,IYM,iShares U.S. Basic Materials ETF,https://www.ishares.com/us/products/239503/ishares-us-basic-materials-etf
213,EMGF,iShares Emerging Markets Equity Factor ETF,https://www.ishares.com/us/products/272820/ishares-msci-emerging-multi-factor-etf
214,MEAR,BlackRock Short Maturity Municipal Bond ETF,https://www.ishares.com/us/products/272112/ishares-short-maturity-municipal-bond-etf
