,ticker,etf,link
215,REZ,iShares Residential and Multisector Real Estate ETF,https://www.ishares.com/us/products/239545/ishares-residential-real-estate-capped-etf
216,EWQ,iShares MSCI France ETF,https://www.ishares.com/us/products/239648/ishares-msci-france-etf
217,EUSB,iShares ESG Advanced Total USD Bond Market ETF,https://www.ishares.com/us/products/314499/ishares-esg-advanced-total-usd-bond-market-etf
218,IAK,iShares U.S. Insurance ETF,https://www.ishares.com/us/products/239515/ishares-us-insurance-etf
219,AGZ,iShares Agency Bond ETF,https://www.ishares.com/us/products/239457/ishares-agency-bond-etf
220,IMCV,iShares Morningstar Mid-Cap Value ETF,https://www.ishares.com/us/products/239584/ishares-morningstar-midcap-value-etf
221,REM,iShares Mortgage Real Estate ETF,https://www.ishares.com/us/products/239543/ishares-mortgage-real-estate-capped-etf
222,HYDB,iShares High Yield Systematic Bond ETF,https://www.ishares.com/us/products/288478/ishares-high-yield-systematic-bond-etf
223,ILTB,iShares Core 10+ Year USD Bond ETF,https://www.ishares.com/us/products/239424/ishares-core-longterm-us-bond-etf
224,ECH,iShares MSCI Chile ETF,https://www.ishares.com/us/products/239618/ishares-msci-chile-capped-etf
225,EXI,iShares Global Industrials ETF,https://www.ishares.com/us/products/239745/ishares-global-industrials-etf
226,AOK,iShares Core Conservative Allocation ETF,https://www.ishares.com/us/products/239733/ishares-conservative-allocation-etf
227,ISCF,iShares International Small-Cap Equity Factor ETF,https://www.ishares.com/us/products/272823/ishares-msci-international-small-cap-multi-factor-etf
228,IAT,iShares U.S. Regional Banks ETF,https://www.ishares.com/us/products/239521/ishares-us-regional-banks-etf
229,ISCG,iShares Morningstar Small-Cap Growth ETF,https://www.ishares.com/us/products/239587/ishares-morningstar-smallcap-growth-etf
230,IGE,iShares North American Natural Resources ETF,https://www.ishares.com/us/products/239768/ishares-north-american-natural-resources-etf
231,IBHE,iShares® iBonds® 2025 Term High Yield and Income ETF,https://www.ishares.com/us/products/308567/ishares-ibonds-2025-term-high-yield-and-income-etf
232,EWH,iShares MSCI Hong Kong ETF,https://www.ishares.com/us/products/239657/ishares-msci-hong-kong-etf
233,IBMN,iShares® iBonds® Dec 2025 Term Muni Bond ETF,https://www.ishares.com/us/products/282964/ishares-ibonds-dec-2025-term-muni-bond-etf
234,IGOV,iShares International Treasury Bond ETF,https://www.ishares.com/us/products/239830/ishares-international-treasury-bond-etf
235,IBTI,iShares® iBonds® Dec 2028 Term Treasury ETF,https://www.ishares.com/us/products/312463/ishares-ibonds-dec-2028-term-treasury-etf
236,RING,iShares MSCI Global Gold Miners ETF,https://www.ishares.com/us/products/239654/ishares-msci-global-gold-miners-etf
237,IBDY,iShares® iBonds® Dec 2033 Term Corporate ETF,https://www.ishares.com/us/products/332289/ishares-ibonds-dec-2033-term-corporate-etf
238,IBMM,iShares® iBonds® Dec 2024 Term Muni Bond ETF,https://www.ishares.com/us/products/282961/ishares-ibonds-dec-2024-term-muni-bond-etf
239,IBMO,iShares® iBonds® Dec 2026 Term Muni Bond ETF,https://www.ishares.com/us/products/308047/ishares-ibonds-dec-2026-term-muni-bond-etf
240,EWI,iShares MSCI Italy ETF,https://www.ishares.com/us/products/239664/ishares-msci-italy-capped-etf
241,HEZU,iShares Currency Hedged MSCI Eurozone ETF,https://www.ishares.com/us/products/268708/ishares-currency-hedged-msci-emu-etf
242,IBHD,iShares® iBonds® 2024 Term High Yield and Income ETF,https://www.ishares.com/us/products/308565/ishares-ibonds-2024-term-high-yield-and-income-etf
243,EEMA,iShares MSCI Emerging Markets Asia ETF,https://www.ishares.com/us/products/239629/ishares-msci-emerging-markets-asia-etf
244,EWS,iShares MSCI Singapore ETF,https://www.ishares.com/us/products/239678/ishares-msci-singapore-capped-etf
245,CEMB,iShares J.P. Morgan EM Corporate Bond ETF,https://www.ishares.com/us/products/239525/ishares-emerging-markets-corporate-bond-etf
246,CMBS,iShares CMBS ETF,https://www.ishares.com/us/products/239459/ishares-cmbs-etf
247,IBMP,iShares® iBonds® Dec 2027 Term Muni Bond ETF,https://www.ishares.com/us/products/308049/ishares-ibonds-dec-2027-term-muni-bond-etf
248,FM,iShares Frontier and Select EM ETF,https://www.ishares.com/us/products/239649/ishares-msci-frontier-100-etf
249,TECB,iShares U.S. Tech Breakthrough Multisector ETF,https://www.ishares.com/us/products/312046/ishares-u-s-tech-breakthrough-multisector-etf
250,LEMB,iShares J.P. Morgan EM Local Currency Bond ETF,https://www.ishares.com/us/products/239528/ishares-emerging-markets-local-currency-bond-etf
251,EMHY,iShares J.P. Morgan EM High Yield Bond ETF,https://www.ishares.com/us/products/239527/ishares-emerging-markets-high-yield-bond-etf
252,ISCV,iShares Morningstar Small-Cap Value ETF,https://www.ishares.com/us/products/239588/ishares-morningstar-smallcap-value-etf
253,EEMS,iShares MSCI Emerging Markets Small-Cap ETF,https://www.ishares.com/us/products/239642/ishares-msci-emerging-markets-smallcap-etf
254,IXG,iShares Global Financials ETF,https://www.ishares.com/us/products/239742/ishares-global-financials-etf
255,HYBB,iShares BB Rated Corporate Bond ETF,https://www.ishares.com/us/products/305259/ishares-bb-rated-corporate-bond-etf
256,IBHF,iShares® iBonds® 2026 Term High Yield and Income ETF,https://www.ishares.com/us/products/316512/ishares-ibonds-2026-term-high-yield-and-income-etf
257,EWD,iShares MSCI Sweden ETF,https://www.ishares.com/us/products/239684/ishares-msci-sweden-etf
258,HEWJ,iShares Currency Hedged MSCI Japan ETF,https://www.ishares.com/us/products/259624/ishares-currency-hedged-msci-japan-etf
259,IXP,iShares Global Comm Services ETF,https://www.ishares.com/us/products/239751/ishares-global-telecom-etf
260,DIVB,iShares Core Dividend ETF,https://www.ishares.com/us/products/291387/ishares-core-dividend-etf
261,LQDH,iShares Interest Rate Hedged Corporate Bond ETF,https://www.ishares.com/us/products/264542/ishares-interest-rate-hedged-corporate-bond-etf
262,BGRN,iShares USD Green Bond ETF,https://www.ishares.com/us/products/305296/ishares-usd-green-bond-etf
263,EIDO,iShares MSCI Indonesia ETF,https://www.ishares.com/us/products/239661/ishares-msci-indonesia-etf
264,EPOL,iShares MSCI Poland ETF,https://www.ishares.com/us/products/239676/ishares-msci-poland-capped-etf
265,IBMQ,iShares® iBonds® Dec 2028 Term Muni Bond ETF,https://www.ishares.com/us/products/308051/ishares-ibonds-dec-2028-term-muni-bond-etf
266,GNMA,iShares GNMA Bond ETF,https://www.ishares.com/us/products/239461/ishares-gnma-bond-etf
267,SIZE,iShares MSCI USA Size Factor ETF,https://www.ishares.com/us/products/251465/ishares-msci-usa-size-factor-etf
268,LCTD,BlackRock World ex U.S. Carbon Transition Readiness ETF,https://www.ishares.com/us/products/318216/blackrock-world-ex-u-s-carbon-transition-readiness-etf
269,EWN,iShares MSCI Netherlands ETF,https://www.ishares.com/us/products/239671/ishares-msci-netherlands-etf
270,CNYA,iShares MSCI China A ETF,https://www.ishares.com/us/products/273318/ishares-msci-china-a-etf
271,CLOA,BlackRock AAA CLO ETF,https://www.ishares.com/us/products/330488/blackrock-aaa-clo-etf
272,SDG,iShares MSCI Global Sustainable Development Goals ETF,https://www.ishares.com/us/products/283378/ishares-msci-global-sustainable-development-goals-etf
273,HYGH,iShares Interest Rate Hedged High Yield Bond ETF,https://www.ishares.com/us/products/264544/ishares-interest-rate-hedged-high-yield-bond-etf
274,EDEN,iShares MSCI Denmark ETF,https://www.ishares.com/us/products/239621/ishares-msci-denmark-capped-etf
275,EWM,iShares MSCI Malaysia ETF,https://www.ishares.com/us/products/239669/ishares-msci-malaysia-etf
276,EWJV,iShares MSCI Japan Value ETF,https://www.ishares.com/us/products/307263/ishares-msci-japan-value-etf
277,IBTJ,iShares® iBonds® Dec 2029 Term Treasury ETF,https://www.ishares.com/us/products/312466/ishares-ibonds-dec-2029-term-treasury-etf
278,IETC,iShares U.S. Tech Independence Focused ETF,https://www.ishares.com/us/products/292425/ishares-u-s-tech-independence-focused-etf
279,MXI,iShares Global Materials ETF,https://www.ishares.com/us/products/239748/ishares-global-materials-etf
280,TUR,iShares MSCI Turkey ETF,https://www.ishares.com/us/products/239689/ishares-msci-turkey-etf
281,XVV,iShares ESG Screened S&P 500 ETF,https://www.ishares.com/us/products/315917/ishares-esg-screened-s-p-500-etf
282,CMDY,iShares Bloomberg Roll Select Commodity Strategy ETF,https://www.ishares.com/us/products/292741/ishares-bloomberg-roll-select-commodity-strategy-etf
283,RXI,iShares Global Consumer Discretionary ETF,https://www.ishares.com/us/products/239739/ishares-global-consumer-discretionary-etf
284,EZA,iShares MSCI South Africa ETF,https://www.ishares.com/us/products/239680/ishares-msci-south-africa-etf
285,GOVZ,iShares 25+ Year Treasury STRIPS Bond ETF,https://www.ishares.com/us/products/315911/ishares-25+-year-treasury-strips-bond-etf
286,THD,iShares MSCI Thailand ETF,https://www.ishares.com/us/products/239688/ishares-msci-thailand-capped-etf
287,IBTK,iShares® iBonds® Dec 2030 Term Treasury ETF,https://www.ishares.com/us/products/314830/ishares-ibonds-dec-2030-term-treasury-etf
288,IDRV,iShares Self-Driving EV and Tech ETF,https://www.ishares.com/us/products/307332/ishares-self-driving-ev-and-tech-etf
289,HAWX,iShares Currency Hedged MSCI ACWI ex U.S. ETF,https://www.ishares.com/us/products/273768/ishares-currency-hedged-msci-acwi-ex-us-etf
290,SLVP,iShares MSCI Global Silver and Metals Miners ETF,https://www.ishares.com/us/products/239656/ishares-msci-global-silver-miners-etf
291,GBF,iShares Government/Credit Bond ETF,https://www.ishares.com/us/products/239462/ishares-governmentcredit-bond-etf
292,ISCB,iShares Morningstar Small-Cap ETF,https://www.ishares.com/us/products/239586/ishares-morningstar-smallcap-etf
293,IYZ,iShares U.S. Telecommunications ETF,https://www.ishares.com/us/products/239523/ishares-us-telecommunications-etf
294,TOK,iShares MSCI Kokusai ETF,https://www.ishares.com/us/products/239668/ishares-msci-kokusai-etf
295,IBTM,iShares® iBonds® Dec 2032 Term Treasury ETF,https://www.ishares.com/us/products/328944/ishares-ibonds-dec-2032-term-treasury-etf
296,XJH,iShares ESG Screened S&P Mid-Cap ETF,https://www.ishares.com/us/products/315914/ishares-esg-screened-s-p-mid-cap-etf
297,IMTB,iShares Core 5-10 Year USD Bond ETF,https://www.ishares.com/us/products/285539/ishares-core-5-10-year-usd-bond-etf
298,BYLD,iShares Yield Optimized Bond ETF,https://www.ishares.com/us/products/264127/ishares-yield-optimized-bond-etf
299,ISVL,iShares International Developed Small Cap Value Factor ETF,https://www.ishares.com/us/products/317548/ishares-international-developed-small-cap-value-factor-etf
300,WOOD,iShares Global Timber & Forestry ETF,https://www.ishares.com/us/products/239752/ishares-global-timber-forestry-etf
301,IBTL,iShares® iBonds® Dec 2031 Term Treasury ETF,https://www.ishares.com/us/products/319421/ishares-ibonds-dec-2031-term-treasury-etf
302,IEZ,iShares U.S. Oil Equipment & Services ETF,https://www.ishares.com/us/products/239518/ishares-us-oil-equipment-services-etf
303,IBTO,iShares® iBonds® Dec 2033 Term Treasury ETF,https://www.ishares.com/us/products/332291/ishares-ibonds-dec-2033-term-treasury-etf
304,EWZS,iShares MSCI Brazil Small-Cap ETF,https://www.ishares.com/us/products/239613/ishares-msci-brazil-smallcap-etf
305,LQDW,iShares Investment Grade Corporate Bond BuyWrite Strategy ETF,https://www.ishares.com/us/products/329120/ishares-investment-grade-corporate-bond-buywrite-strategy-etf
306,HEEM,iShares Currency Hedged MSCI Emerging Markets ETF,https://www.ishares.com/us/products/268704/ishares-currency-hedged-msci-emerging-markets
307,IGBH,iShares Interest Rate Hedged Long-Term Corporate Bond ETF,https://www.ishares.com/us/products/275397/ishares-interest-rate-hedged-10-year-credit-bond-etf
308,EIS,iShares MSCI Israel ETF,https://www.ishares.com/us/products/239663/ishares-msci-israel-capped-etf
309,IDNA,iShares Genomics Immunology and Healthcare ETF,https://www.ishares.com/us/products/308878/ishares-genomics-immunology-and-healthcare-etf
310,GHYG,iShares US & Intl High Yield Corp Bond ETF,https://www.ishares.com/us/products/239551/ishares-global-high-yield-corporate-bond-etf
311,HSCZ,iShares Currency Hedged MSCI EAFE Small-Cap ETF,https://www.ishares.com/us/products/273771/ishares-currency-hedged-msci-eafe-small-cap-etf
312,JXI,iShares Global Utilities ETF,https://www.ishares.com/us/products/239753/ishares-global-utilities-etf
313,HYXF,iShares ESG Advanced High Yield Corporate Bond ETF,https://www.ishares.com/us/products/283857/ishares-esg-advanced-high-yield-corporate-bond-etf
314,GLOF,iShares Global Equity Factor ETF,https://www.ishares.com/us/products/272821/ishares-msci-global-multi-factor-etf
315,IBHG,iShares® iBonds® 2027 Term High Yield and Income ETF,https://www.ishares.com/us/products/319422/ishares-ibonds-2027-term-high-yield-and-income-etf
316,SCJ,iShares MSCI Japan Small-Cap ETF,https://www.ishares.com/us/products/239666/ishares-msci-japan-smallcap-etf
317,VEGI,iShares MSCI Agriculture Producers ETF,https://www.ishares.com/us/products/239652/ishares-msci-global-agriculture-producers-etf
318,EPU,iShares MSCI Peru and Global Exposure ETF,https://www.ishares.com/us/products/239606/ishares-msci-all-peru-capped-etf
319,IYLD,iShares Morningstar Multi-Asset Income ETF,https://www.ishares.com/us/products/239585/ishares-morningstar-multiasset-income-etf
320,EIRL,iShares MSCI Ireland ETF,https://www.ishares.com/us/products/239662/ishares-msci-ireland-capped-etf
321,FILL,iShares MSCI Global Energy Producers ETF,https://www.ishares.com/us/products/239653/ishares-msci-global-energy-producers-etf
322,HYMU,BlackRock High Yield Muni Income Bond ETF,https://www.ishares.com/us/products/317978/blackrock-high-yield-muni-income-bond-etf
323,IFGL,iShares International Developed Real Estate ETF,https://www.ishares.com/us/products/239540/ishares-international-developed-real-estate-etf
324,IEUS,iShares MSCI Europe Small-Cap ETF,https://www.ishares.com/us/products/239537/ishares-developed-smallcap-ex-north-america-etf
325,EPHE,iShares MSCI Philippines ETF,https://www.ishares.com/us/products/239675/ishares-msci-philippines-etf
326,IBMR,iShares® iBonds® Dec 2029 Term Muni Bond ETF,https://www.ishares.com/us/products/331834/ishares-ibonds-dec-2029-term-muni-bond-etf
327,JPXN,iShares JPX-Nikkei 400 ETF,https://www.ishares.com/us/products/239831/ishares-japan-largecap-etf
328,ENZL,iShares MSCI New Zealand ETF,https://www.ishares.com/us/products/239672/ishares-msci-new-zealand-capped-etf
329,BRTR,BlackRock Total Return ETF,https://www.ishares.com/us/products/334572/blackrock-total-return-etf
330,ISHG,iShares 1-3 Year International Treasury Bond ETF,https://www.ishares.com/us/products/239829/ishares-13-year-international-treasury-bond-etf
331,IBHH,iShares® iBonds® 2028 Term High Yield and Income ETF,https://www.ishares.com/us/products/326459/ishares-ibonds-2028-term-high-yield-and-income-etf
332,EMXF,iShares ESG Advanced MSCI EM ETF,https://www.ishares.com/us/products/316020/ishares-esg-advanced-msci-em-etf
333,QAT,iShares MSCI Qatar ETF,https://www.ishares.com/us/products/264273/ishares-msci-qatar-capped-etf
334,GARP,iShares MSCI USA Quality GARP ETF ,https://www.ishares.com/us/products/312212/ishares-msci-usa-quality-garp-etf
335,BKF,iShares MSCI BIC ETF,https://www.ishares.com/us/products/239614/ishares-msci-bric-etf
336,XJR,iShares ESG Screened S&P Small-Cap ETF,https://www.ishares.com/us/products/315920/ishares-esg-screened-s-p-small-cap-etf
337,KWT,iShares MSCI Kuwait ETF,https://www.ishares.com/us/products/312763/ishares-msci-kuwait-etf
338,SVAL,iShares US Small Cap Value Factor ETF,https://www.ishares.com/us/products/316394/ishares-us-small-cap-value-factor-etf
339,FIBR,iShares U.S. Fixed Income Balanced Risk Systematic ETF,https://www.ishares.com/us/products/271544/ishares-us-fixed-income-balanced-risk-etf
340,EWO,iShares MSCI Austria ETF,https://www.ishares.com/us/products/239609/ishares-msci-austria-capped-etf
341,IVVB,iShares Large Cap Deep Buffer ETF,https://www.ishares.com/us/products/332307/ishares-large-cap-deep-buffer-etf
342,HYGW,iShares High Yield Corporate Bond BuyWrite Strategy ETF,https://www.ishares.com/us/products/329119/ishares-high-yield-corporate-bond-buywrite-strategy-etf
343,ECNS,iShares MSCI China Small-Cap ETF,https://www.ishares.com/us/products/239620/ishares-msci-china-smallcap-etf
344,PABD,iShares Paris-Aligned Climate MSCI World ex USA ETF,https://www.ishares.com/us/products/335054/ishares-paris-aligned-climate-msci-world-ex-usa-etf
345,LQDI,iShares Inflation Hedged Corporate Bond ETF,https://www.ishares.com/us/products/294319/ishares-inflation-hedged-corporate-bond-etf
346,HYXU,iShares International High Yield Bond ETF,https://www.ishares.com/us/products/239550/ishares-global-ex-usd-high-yield-corporate-bond-etf
347,CCRV,iShares Commodity Curve Carry Strategy ETF,https://www.ishares.com/us/products/310784/ishares-commodity-curve-carry-strategy-etf
348,IBHI,iShares® iBonds® 2029 Term High Yield and Income ETF,https://www.ishares.com/us/products/326462/ishares-ibonds-2029-term-high-yield-and-income-etf
349,BALI,BlackRock Advantage Large Cap Income ETF,https://www.ishares.com/us/products/333207/blackrock-advantage-large-cap-income-etf
350,IAUF,iShares Gold Strategy ETF,https://www.ishares.com/us/products/293782/ishares-gold-strategy-etf
351,DVYA,iShares Asia/Pacific Dividend ETF,https://www.ishares.com/us/products/239443/ishares-asiapacific-dividend-etf
352,EWUS,iShares MSCI United Kingdom Small-Cap ETF,https://www.ishares.com/us/products/239691/ishares-msci-united-kingdom-smallcap-etf
353,IVVM,iShares Large Cap Moderate Buffer ETF,https://www.ishares.com/us/products/332306/ishares-large-cap-moderate-buffer-etf
354,BRLN,BlackRock Floating Rate Loan ETF,https://www.ishares.com/us/products/329872/blackrock-floating-rate-loan-etf
355,IDGT,iShares U.S. Digital Infrastructure and Real Estate ETF,https://www.ishares.com/us/products/239770/ishares-north-american-techmultimedia-networking-etf
356,BEMB,iShares J.P. Morgan Broad USD Emerging Markets Bond ETF,https://www.ishares.com/us/products/329561/ishares-j-p-morgan-broad-usd-emerging-markets-bond-etf
357,UAE,iShares MSCI UAE ETF,https://www.ishares.com/us/products/264275/ishares-msci-uae-capped-etf
358,WPS,iShares International Developed Property ETF,https://www.ishares.com/us/products/239734/ishares-international-developed-property-etf
359,ICOP,iShares Copper and Metals Mining ETF,https://www.ishares.com/us/products/332280/ishares-copper-and-metals-mining-etf
360,LDEM,iShares ESG MSCI EM Leaders ETF,https://www.ishares.com/us/products/312222/ishares-esg-msci-em-leaders-etf
361,LQDB,iShares BBB Rated Corporate Bond ETF,https://www.ishares.com/us/products/318688/ishares-bbb-rated-corporate-bond-etf
362,HEWG,iShares Currency Hedged MSCI Germany ETF,https://www.ishares.com/us/products/259623/ishares-currency-hedged-msci-germany-etf
363,ENOR,iShares MSCI Norway ETF,https://www.ishares.com/us/products/239673/ishares-msci-norway-capped-etf
364,EAOA,iShares ESG Aware Aggressive Allocation ETF,https://www.ishares.com/us/products/314414/ishares-esg-aware-aggressive-allocation-etf
365,CALY,BlackRock Short-Term California Muni Bond ETF,https://www.ishares.com/us/products/332497/blackrock-short-term-california-muni-bond-etf
366,EMIF,iShares Emerging Markets Infrastructure ETF,https://www.ishares.com/us/products/239735/ishares-emerging-markets-infrastructure-etf
367,IEDI,iShares U.S. Consumer Focused ETF,https://www.ishares.com/us/products/292414/ishares-u-s-consumer-focused-etf
368,IBLC,iShares Blockchain and Tech ETF,https://www.ishares.com/us/products/326614/ishares-blockchain-and-tech-etf
369,INMU,BlackRock Intermediate Muni Income Bond ETF,https://www.ishares.com/us/products/317976/blackrock-intermediate-muni-income-bond-etf
370,IBHJ,iShares® iBonds® 2030 Term High Yield and Income ETF,https://www.ishares.com/us/products/332287/ishares-ibonds-2030-term-high-yield-and-income-etf
371,EFNL,iShares MSCI Finland ETF,https://www.ishares.com/us/products/239647/ishares-msci-finland-capped-etf
372,EAOR,iShares ESG Aware Growth Allocation ETF,https://www.ishares.com/us/products/314409/ishares-esg-aware-growth-allocation-etf
373,IVVW,iShares S&P 500 BuyWrite ETF,https://www.ishares.com/us/products/336267/ishares-s-p-500-buywrite-etf
374,FOVL,iShares Focused Value Factor ETF,https://www.ishares.com/us/products/307330/ishares-focused-value-factor-etf
375,IBIC,iShares® iBonds® Oct 2026 Term TIPS ETF,https://www.ishares.com/us/products/333118/ishares-ibonds-oct-2026-term-tips-etf
376,IBID,iShares® iBonds® Oct 2027 Term TIPS ETF,https://www.ishares.com/us/products/333135/ishares-ibonds-oct-2027-term-tips-etf
377,IBIE,iShares® iBonds® Oct 2028 Term TIPS ETF,https://www.ishares.com/us/products/333132/ishares-ibonds-oct-2028-term-tips-etf
378,EWK,iShares MSCI Belgium ETF,https://www.ishares.com/us/products/239610/ishares-msci-belgium-capped-etf
379,IBIB,iShares® iBonds® Oct 2025 Term TIPS ETF,https://www.ishares.com/us/products/333138/ishares-ibonds-oct-2025-term-tips-etf
380,IWMW,iShares Russell 2000 BuyWrite ETF,https://www.ishares.com/us/products/336263/ishares-russell-2000-buywrite-etf
381,IBIF,iShares® iBonds® Oct 2029 Term TIPS ETF,https://www.ishares.com/us/products/333141/ishares-ibonds-oct-2029-term-tips-etf
382,IBIJ,iShares® iBonds® Oct 2033 Term TIPS ETF,https://www.ishares.com/us/products/333076/ishares-ibonds-oct-2033-term-tips-etf
383,BTEK,BlackRock Future Tech ETF,https://www.ishares.com/us/products/316011/blackrock-future-tech-etf
384,IBIA,iShares® iBonds® Oct 2024 Term TIPS ETF,https://www.ishares.com/us/products/333126/ishares-ibonds-oct-2024-term-tips-etf
385,IBIG,iShares® iBonds® Oct 2030 Term TIPS ETF,https://www.ishares.com/us/products/333128/ishares-ibonds-oct-2030-term-tips-etf
386,IBIH,iShares® iBonds® Oct 2031 Term TIPS ETF,https://www.ishares.com/us/products/333121/ishares-ibonds-oct-2031-term-tips-etf
387,USBF,iShares USD Systematic Bond ETF,https://www.ishares.com/us/products/320598/ishares-usd-systematic-bond-etf
388,ELQD,iShares ESG Advanced Investment Grade Corporate Bond ETF,https://www.ishares.com/us/products/321326/ishares-esg-advanced-investment-grade-corporate-bond-etf
389,ESMV,iShares ESG MSCI USA Min Vol Factor ETF,https://www.ishares.com/us/products/321324/ishares-esg-msci-usa-min-vol-factor-etf
390,TMET,iShares Transition-Enabling Metals ETF,https://www.ishares.com/us/products/333404/ishares-transition-enabling-metals-etf
391,ITDC,iShares® LifePath® Target Date 2035 ETF,https://www.ishares.com/us/products/333558/ishares-lifepath-target-date-2035-etf
392,IBDZ,iShares® iBonds® Dec 2034 Term Corporate ETF,https://www.ishares.com/us/products/337465/ishares-ibonds-dec-2034-term-corporate-etf
393,ITDF,iShares® LifePath® Target Date 2050 ETF,https://www.ishares.com/us/products/333566/ishares-lifepath-target-date-2050-etf
394,ITDE,iShares® LifePath® Target Date 2045 ETF,https://www.ishares.com/us/products/333564/ishares-lifepath-target-date-2045-etf
395,IBII,iShares® iBonds® Oct 2032 Term TIPS ETF,https://www.ishares.com/us/products/333079/ishares-ibonds-oct-2032-term-tips-etf
396,IBHK,iShares® iBonds® 2031 Term High Yield and Income ETF,https://www.ishares.com/us/products/337468/ishares-ibonds-2031-term-high-yield-and-income-etf
397,ITDD,iShares® LifePath® Target Date 2040 ETF,https://www.ishares.com/us/products/333561/ishares-lifepath-target-date-2040-etf
398,ITDB,iShares® LifePath® Target Date 2030 ETF,https://www.ishares.com/us/products/333555/ishares-lifepath-target-date-2030-etf
399,ERET,iShares Environmentally Aware Real Estate ETF,https://www.ishares.com/us/products/329687/ishares-environmentally-aware-real-estate-etf
400,IBAT,iShares Energy Storage & Materials ETF,https://www.ishares.com/us/products/336296/ishares-energy-storage-materials-etf
401,EAOK,iShares ESG Aware Conservative Allocation ETF,https://www.ishares.com/us/products/314417/ishares-esg-aware-conservative-allocation-etf
402,IDAT,iShares Future Cloud 5G and Tech ETF,https://www.ishares.com/us/products/307350/ishares-future-cloud-5g-and-tech-etf
403,BTHM,BlackRock Future U.S. Themes ETF,https://www.ishares.com/us/products/325384/blackrock-future-u-s-themes-etf
404,BLCR,BlackRock Large Cap Core ETF,https://www.ishares.com/us/products/333889/blackrock-large-cap-core-etf
405,BLCV,BlackRock Large Cap Value ETF,https://www.ishares.com/us/products/331795/blackrock-large-cap-value-etf
406,TCHI,iShares MSCI China Multisector Tech ETF,https://www.ishares.com/us/products/325390/ishares-msci-china-multisector-tech-etf
407,ITDG,iShares® LifePath® Target Date 2055 ETF,https://www.ishares.com/us/products/333570/ishares-lifepath-target-date-2055-etf
408,IVRS,iShares Future Metaverse Tech and Communications ETF,https://www.ishares.com/us/products/330840/ishares-future-metaverse-tech-and-communications-etf
409,EGUS,iShares ESG Aware MSCI USA Growth ETF,https://www.ishares.com/us/products/330808/ishares-esg-aware-msci-usa-growth-etf
410,IWTR,iShares MSCI Water Management Multisector ETF,https://www.ishares.com/us/products/329650/ishares-msci-water-management-multisector-etf
411,EAOM,iShares ESG Aware Moderate Allocation ETF,https://www.ishares.com/us/products/314411/ishares-esg-aware-moderate-allocation-etf
412,INRO,BlackRock U.S. Industry Rotation ETF,https://www.ishares.com/us/products/336430/blackrock-u-s-industry-rotation-etf
413,EVUS,iShares ESG Aware MSCI USA Value ETF,https://www.ishares.com/us/products/330809/ishares-esg-aware-msci-usa-value-etf
414,ISZE,iShares MSCI Intl Size Factor ETF,https://www.ishares.com/us/products/275384/ishares-msci-international-developed-size-factor-etf
415,BGRO,BlackRock Large Cap Growth ETF,https://www.ishares.com/us/products/337538/blackrock-large-cap-growth-etf
